{
  "$schema": "https://json-schema.org/draft/2020-12/schema",
  "title": "rustle app.json",
  "description": "Optional metadata at the top of a rustle package. See SPEC.md, section 4.",
  "type": "object",
  "properties": {
    "$schema": { "type": "string" },
    "format": {
      "description": "Package format version. Absent means 1. A host refuses a format newer than it supports.",
      "type": "integer", "minimum": 1, "default": 1
    },
    "title": { "description": "Name shown in the app list.", "type": "string" },
    "description": { "description": "One or two sentences shown under the title.", "type": "string" },
    "page": {
      "description": "Path of the app's own page inside the package. Without it the host looks for index.html, then demo/index.html, www/index.html and web/index.html.",
      "type": "string",
      "pattern": "^[A-Za-z0-9_\\-][A-Za-z0-9_.\\-]*(/[A-Za-z0-9_\\-][A-Za-z0-9_.\\-]*)*$"
    }
  },
  "additionalProperties": false
}
